{
    "$schema": "http://json-schema.org/draft-06/schema#",
    "$id": "http://json-schema.org/draft-06/schema#",
    "title": "Core schema meta-schema",
    "additionalProperties": false,
    "definitions": {
        "schemaArray": {
            "type": "array",
            "minItems": 1,
            "items": {
                "$ref": "#"
            }
        },
        "nonNegativeInteger": {
            "type": "integer",
            "minimum": 0
        },
        "simpleTypes": {
            "enum": [
                "array",
                "boolean",
                "integer",
                "null",
                "number",
                "object",
                "string"
            ]
        },
        "stringArray": {
            "type": "array",
            "items": {
                "type": "string"
            },
            "uniqueItems": true,
            "default": []
        }
    },
    "type": [
        "object",
        "boolean"
    ],
    "properties": {
        "id": {
            "type": "string",
            "format": "uri-reference"
        },
        "$id": {
            "type": "string",
            "format": "uri-reference"
        },
        "$schema": {
            "type": "string",
            "format": "uri"
        },
        "$ref": {
            "type": "string",
            "format": "uri-reference"
        },
        "title": {
            "type": "string"
        },
        "description": {
            "type": "string"
        },
        "default": {},
        "examples": {
            "type": "array",
            "items": {}
        },
        "multipleOf": {
            "type": "number",
            "minimum": 0,
            "not": {
                "enum": [
                    0
                ]
            }
        },
        "maximum": {
            "type": "number"
        },
        "minimum": {
            "type": "number"
        },
        "maxLength": {
            "$ref": "#/definitions/nonNegativeInteger"
        },
        "minLength": {
            "$ref": "#/definitions/nonNegativeInteger"
        },
        "pattern": {
            "type": "string",
            "format": "regex"
        },
        "additionalItems": {
            "$ref": "#"
        },
        "items": {
            "anyOf": [
                {
                    "$ref": "#"
                },
                {
                    "$ref": "#/definitions/schemaArray"
                }
            ],
            "default": {}
        },
        "maxItems": {
            "$ref": "#/definitions/nonNegativeInteger"
        },
        "minItems": {
            "$ref": "#/definitions/nonNegativeInteger"
        },
        "uniqueItems": {
            "type": "boolean",
            "default": false
        },
        "contains": {
            "$ref": "#"
        },
        "maxProperties": {
            "$ref": "#/definitions/nonNegativeInteger"
        },
        "minProperties": {
            "$ref": "#/definitions/nonNegativeInteger"
        },
        "required": {
            "$ref": "#/definitions/stringArray"
        },
        "additionalProperties": {
            "$ref": "#"
        },
        "definitions": {
            "type": "object",
            "additionalProperties": {
                "$ref": "#"
            },
            "default": {}
        },
        "properties": {
            "type": "object",
            "additionalProperties": {
                "$ref": "#"
            },
            "default": {}
        },
        "dependencies": {
            "type": "object",
            "additionalProperties": {
                "anyOf": [
                    {
                        "$ref": "#"
                    },
                    {
                        "$ref": "#/definitions/stringArray"
                    }
                ]
            }
        },
        "propertyNames": {
            "$ref": "#"
        },
        "const": {},
        "enum": {
            "type": "array",
            "minItems": 1,
            "uniqueItems": true
        },
        "type": {
            "anyOf": [
                {
                    "$ref": "#/definitions/simpleTypes"
                },
                {
                    "type": "array",
                    "items": {
                        "$ref": "#/definitions/simpleTypes"
                    },
                    "minItems": 1,
                    "uniqueItems": true
                }
            ]
        },
        "format": {
            "type": "string"
        },
        "allOf": {
            "$ref": "#/definitions/schemaArray"
        },
        "anyOf": {
            "$ref": "#/definitions/schemaArray"
        },
        "oneOf": {
            "$ref": "#/definitions/schemaArray"
        },
        "not": {
            "$ref": "#"
        }
    },
    "default": {}
}